{
  "manifest_schema_version": "project-manifest-1.0",
  "project_id": "fictional-legacy-adapter",
  "project_title": "Synthetic Legacy Adapter Review",
  "initial_user_intent": {"goal": "Validate synthetic adapter closure.", "scope": "Use only supplied synthetic inputs."},
  "discovery_policy": "CLOSED_CORPUS",
  "output_language": "en",
  "citation_style": "BRACKETED_NUMERIC",
  "paths": {"seed_source_root": "inputs/papers", "project_data_root": "state", "export_root": "exports"},
  "initial_source_inputs": [
    {"source_id": "GOOD", "paper_id": "LEGACY100", "relative_path": "legacy100/main.txt", "document_role": "MAIN", "usage_role": "EVIDENCE"},
    {"source_id": "WRONG", "paper_id": "LEGACY100", "relative_path": "legacy100/si.txt", "document_role": "SI", "usage_role": "EVIDENCE"},
    {"source_id": "EXCLUDED", "paper_id": "LEGACY200", "relative_path": "legacy200/main.txt", "document_role": "MAIN", "usage_role": "EVIDENCE"}
  ],
  "network_policy": "OFFLINE_ONLY",
  "adapter_ref": "case-01-frozen-v1"
}
